{
  "patient_id": "children__v307",
  "metadata": {
    "schema_version": "2.0.0-draft",
    "source_dataset": "adhd_children",
    "annotation": {
      "seed": 4118107855,
      "generation_basis": [
        "measured_signal_features",
        "diagnosis_conditioned_synthetic_clinical_profile"
      ]
    },
    "demographics": {
      "sex": "female",
      "age_years": 10,
      "age_group": "child",
      "handedness": "right",
      "education_context": "primary_school"
    }
  },
  "resources": {
    "clinical_profile": "clinical_profile.json",
    "recordings": "recordings.json",
    "segments": "segments.json",
    "signals": "signals.npz"
  },
  "clinical_ground_truth": {
    "diagnosis": "NOT_ADHD",
    "label_source": "source_dataset_group",
    "verified": true
  },
  "curriculum_targets": {
    "diagnostic_cot": {
      "scope": "patient",
      "supervision": "synthetic_clinical_profile_plus_measured_eeg_features",
      "input_references": {
        "recording_ids": [
          "visual-attention-01"
        ],
        "clinical_profile": "clinical_profile.json"
      },
      "target": {
        "eeg_evidence": [
          "The mean recording-level theta-to-beta ratio is 1.991.",
          "The EEG findings are nonspecific and are treated only as supporting context."
        ],
        "clinical_evidence": [
          "The synthetic profile contains 3 inattentive symptoms.",
          "Functional impact is limited to no settings.",
          "Informant narratives do not describe a persistent cross-setting pattern."
        ],
        "alternative_explanations": [
          "May account for occasional attention variability.",
          "Additional clinical screening remains appropriate where indicated."
        ],
        "reasoning_steps": [
          "The duration and distribution of synthetic symptoms are reviewed.",
          "Functional impairment and agreement between informants are considered.",
          "Alternative explanations are compared with the represented symptom pattern.",
          "EEG summaries are retained as supporting context rather than diagnostic proof."
        ],
        "conclusion": {
          "diagnosis": "NOT_ADHD",
          "presentation": "not_applicable",
          "severity": "none",
          "confidence": "moderate"
        }
      }
    }
  }
}
