{
  "patient_id": "children__v254",
  "metadata": {
    "schema_version": "2.0.0-draft",
    "source_dataset": "adhd_children",
    "annotation": {
      "seed": 2792132383,
      "generation_basis": [
        "measured_signal_features",
        "diagnosis_conditioned_synthetic_clinical_profile"
      ]
    },
    "demographics": {
      "sex": "female",
      "age_years": 12,
      "age_group": "child",
      "handedness": "left",
      "education_context": "primary_school"
    }
  },
  "resources": {
    "clinical_profile": "clinical_profile.json",
    "recordings": "recordings.json",
    "segments": "segments.json",
    "signals": "signals.npz"
  },
  "clinical_ground_truth": {
    "diagnosis": "ADHD",
    "label_source": "source_dataset_group",
    "verified": true
  },
  "curriculum_targets": {
    "diagnostic_cot": {
      "scope": "patient",
      "supervision": "synthetic_clinical_profile_plus_measured_eeg_features",
      "input_references": {
        "recording_ids": [
          "visual-attention-01"
        ],
        "clinical_profile": "clinical_profile.json"
      },
      "target": {
        "eeg_evidence": [
          "The mean recording-level theta-to-beta ratio is 2.970.",
          "The EEG findings are nonspecific and are treated only as supporting context."
        ],
        "clinical_evidence": [
          "The synthetic profile contains 6 inattentive symptoms.",
          "Reports from parent and teacher describe difficulty in more than one setting.",
          "The synthetic history describes persistent functional impairment."
        ],
        "alternative_explanations": [
          "May contribute to fatigue but does not fully explain the cross-setting symptom pattern.",
          "Additional clinical screening remains appropriate where indicated."
        ],
        "reasoning_steps": [
          "The duration and distribution of synthetic symptoms are reviewed.",
          "Functional impairment and agreement between informants are considered.",
          "Alternative explanations are compared with the represented symptom pattern.",
          "EEG summaries are retained as supporting context rather than diagnostic proof."
        ],
        "conclusion": {
          "diagnosis": "ADHD",
          "presentation": "predominantly_inattentive",
          "severity": "moderate",
          "confidence": "moderate"
        }
      }
    }
  }
}
